id,sentence
3731,Iban sin taymanghud niya hi Andariyas.
3732,Ampa hi Yaꞌkub iban sin taymanghud niya hi Yahiya.
3733,Amu in anak hi Sibidi.
3734,Sumunu hi Pilip iban hi Bartulumi.
3735,Ampa hi Tumas iban hi Matiyu.
3736,Amu in mangangawa sukay pa parinta.
3737,Ampa isab hi Yaꞌkub amu in anak hi Alpa.
3738,Sumunu hi Tadiyus.
3739,Ampa hi Simun amu in bantug simulang ha parinta Rūm.
3740,"In hinapusan hi Judas, tau dayn ha Kiriyud, amu in manipu kan Īsa."
3741,In hangpu tagduwangka-tau ini diyaak hi Īsa manaw.
3742,Ha way pa sila miyanaw biyandaan sila hi Īsa.
3743,"Laung niya, “Ayaw kamu madtu pa hula sin manga tau bukun bangsa Yahudi."
3744,Atawa pa manga dāira sin manga tau Samariya.”
3745,Sagawa kadtu kamu pa manga tau bangsa Israil.
3746,Amu in biya bili-bili nalalawa dayn ha magiipat kanila.
3747,Kadtu kamu magnasīhat sin in pamarinta sin Tuhan masuuk na dumatung mari!
3748,Paulia niyu in manga nasasakit.
3749,Buhia niyu magbalik in manga tau patay.
3750,Paulia niyu in manga tau īipul.
3751,Iban paguwaa niyu in manga saytan dayn ha baran sin manga tau.
3752,Timayma kamu dayn kaku sin manga hinang yan ha wayruun bayad.
3753,"Na, pangdihil kamu ha wayruun da isab bayad."
3754,Ayaw kamu magdā bulawan atawa pilak ha lawm bulsa niyu.
3755,Minsan pisita ayaw kamu magdā.
3756,Ayaw kamu isab dumā pagluluunan sin kapanyapan niyu.
3757,Atawa tamungun dugaing dayn sin ha baran niyu.
3758,Atawa tawmpa iban tungkud.
3759,Sabab in maghihinang tūp balanjaan sin manga tau piyaghulas-sangsaan niya.
3760,"Bang kamu dumatung pa hambuuk dāira atawa hambuuk kawman, paglawag kamu tau."
3761,Amu in mabaya gabanan niyu.
3762,Hāti duun kamu humanti kanila ha salugay niyu duun ha hula yan.
3763,"Bang kamu sumūd pa lawm bāy sin tau pamung kamu, laung niyu, ‘Bang mayan kamu ha lawm kasannyangan sadja.’"
3764,Manjari bang kamu taymaun sin tau ha lawm bāy yan.
3765,Na datungan sila sin kasannyangan amu in piyagiyan niyu.
3766,"Sagawa bang sila di tumayma kaniyu, bawia niyu in kasannyangan yan dayn kanila."
3767,"Na bang awn manga tau ha bāy iban dāira amu in di tumayma kaniyu atawa di dumungug sin panghindu niyu, īg kamu dayn ha lugal yan."
3768,Paspasi niyu in bagunbun dayn ha siki niyu.
3769,Ha supaya mapakita niyu in tanda sin di sila tūpun parulihun niyu.
3770,"Baytaan ta kamu, bang ha adlaw paghukum na, mabuggat in hukuman hibutang sin Tuhan pa manga tau ha kawman yan."
3771,Labi pa in buggat niya dayn sin hukuman hibutang pa manga tau ha dāira Sudum iban dāira Gumura.
3772,"Dungug kamu, laung hi Īsa."
3773,Yari kamu sūng daakun ku pa manga tau.
3774,Biya kamu sapantun bili-bili pakadtuun pa lawm baanan iru talun amu in mangangaun kanila.
3775,Hangkan subay kamu taga akkal tuud.
3776,Iban subay mabuntul tuud in lawm atay niyu.
3777,"Jaga kamu, sabab ha waktu susūngun awn manga tau sumaggaw kaniyu."
3778,Ampa kamu hiungsud pa lawm lima sin manga manghuhukum.
3779,Iban lubakan kamu sin manga tau duun ha lawm manga langgal.
3780,Marā da isab kamu pa alupan sin manga gubnul iban manga sultan.
3781,Sanglit hukuman sabab in kamu agad kaku.
3782,"Na, bang kamu marā na madtu, makabayta na kamu kanila iban pa manga tau kaibanan."
3783,Amu in bukun bangsa Yahudi.
3784,Pasal sin Bayta Marayaw.
3785,Pasal sin pamarinta sin Tuhan.
3786,"Bang kamu hisampay na pa paghuhukuman, ayaw kamu masusa bang unu in hibichara niyu."
3787,Atawa bang biya diin in kaagi niyu mamichara.
3788,Sabab in lapal hibichara niyu bukun dayn ha lawm pamikil niyu.
3789,"Sa dayn ha Rū sin Tuhan, Ama niyu."
3790,Amu in mamichara sin manga kabtangan gumuwa dayn ha simud niyu.
3791,Ha waktu susūngun maggaus na in magtalianak.
3792,Hitukbal sin tau in taymanghud niya hipapatay.
3793,Iban hitukbal da isab sin ama in anak niya hipabunu.
3794,Iban umatu na in anak ha maas nila.
3795,Iban hipapatay nila in maas nila.
3796,"Na, kamu isab manga mulid ku."
3797,Karugalan kamu sin tau katān.
3798,Sabab in kamu agad kaku.
3799,Sagawa hisiyu-siyu in sumandal sin manga kasigpitan iban kabinsanaan yan sampay pa kahinapusan.
3800,Tantu malappas da siya.
3801,"Bang kamu binasahun nila ha hambuuk dāira, paguy kamu pa dugaing dāira."
3802,"Baytaan ta kamu, ha di niyu pa malatag katān nasīhatan in manga dāira ha hula natu ini Israil."
3803,In aku amu in Anak Mānusiya.
3804,Magbalik na mari pa dunya.
3805,Wayruun anak mulid in mataas dayn ha guru niya.
3806,Damikkiyan da isab wayruun tindug in makawasa dayn ha nakura niya.
3807,Hangkan subay magsukul in mulid makasibu ha guru niya.
3808,Iban subay magsukul in tindug mabiya sin nakura niya.
3809,"Na, bang in aku amu in nakura sin manga tindug ku tiyawag nila nakura sin saytan."
3810,Na luba pa in kamu manga tindug ku in di tawagun nila sin manga ngān mangī
3811,Hangkan sa ayaw kamu mabuga ha manga tau.
3812,Karna unu-unu in tiyatapuk tantu gumuwa da.
3813,Unu-unu isab in līlibun tantu kaingatan da.
3814,Unu-unu in hibayta ku kaniyu ha katigidluman subay niyu hibayta magbalik ha kasawahan.
3815,Iban unu-unu in kiyahagas-hagas kaniyu.
3816,Subay niyu hipamahalayak pa katān mānusiya.
3817,Ayaw kamu mabuga ha manga makapatay sin baran niyu sa di makapatay sin nyawa niyu.
3818,Sagawa subay Tuhan in kabugaan niyu.
3819,Sabab siya in makasiksa sin baran iban nyawa niyu ha lawm narka.
3820,Pikila niyu ba in manga manuk-manuk asibi yan.
3821,Biya wayruun tuud halga nila.
3822,"Mabī ta duwa, hambuuk sīn."
3823,"Malayngkan, wayruun da isab minsan hambuuk manuk-manuk in mahulug pa lupa."
3824,"Bang bukun kabayaan sin Tuhan, Ama niyu."
3825,"Na, damikkiyan in kamu minsan in taud sin buhuk ha ū niyu naiitung katān sin Tuhan."
3826,"Hangkan sa, ayaw kamu mabuga."
3827,Sabab labi kamu māyu mahalga dayn ha manga manuk-manuk minsan pila in taud nila.
3828,Hisiyu-siyu in magsabunnal ha katauran tau sin agad siya kaku.
3829,"Magsabunnal da isab aku ha alupan sin Tuhan, Ama ku ha surga."
3830,Sin in siya agad kaku.
3831,Sagawa hisiyu-siyu in mamaylu ha katauran tau.
3832,Sin bukun siya agad kaku.
3833,"Mamaylu da isab aku ha alupan sin Tuhan, Ama ku ha surga."
3834,Sin bukun siya agad kaku.
3835,Ayaw kamu magpikil sin in pagkari ku pa dunya nakarā kasannyangan.
3836,Sabab aku in nakalingug ha manga mānusiya.
3837,Aku in mahinang puun-sabab sin gumuwa sin luwas ha dunya.
3838,"Ampa in mabug-at niyu, kay in sabat sin ini amu in pangtaw."
3839,"Ha pahuya sin taimanghud pa mānusiya, ha pangtuud na."
3840,"Na, ako di nangaral sin panghalang sin mabantug sin luwas sin Dios."
3841,Ampa sin pagtatalang sin hangpu tagduwangka-tau.
3842,Sabab ini hi pangun-hangun sin paglaum.
3843,"Manjari pagꞌubus yadtu, saꞌbu adlaw Sabtuꞌ."
3844,Amu in adlaw paghali-hali iban pagpudji pa Tuhan sin manga Yahudi.
3845,In hi Īsa iban sin manga mulid niya limabay dayn ha lawm uma.
3846,Sakali nangutul bunga sin tiyanum.
3847,"In manga mulid niya, ampa nila kiyaun sabab hiyapdiꞌ na sila."
3848,Pagkitaꞌ sin manga Yahudi pagtawagun Parisi sin hinang nila.
3849,"Laung nila kan Īsa, “Uy, langgal saraꞌ sin agama in hīnang sin manga mulid mu."
3850,Sabab adlaw paghali-hali iban pagpudji pa Tuhan adlaw ini!”
3851,"Laung hi Īsa kanila, “Maytaꞌ, walaꞌ niyu ka nabacha ha lawm Kitab in hīnang hi Daud."
3852,Iban sin manga tau niya ha waktu hiyapdiꞌ sila?
3853,Simūd sila pa lawm Bāy sin Tuhan.
3854,Ampa sila kimaun sin kakaun bakas iyungsud pa Tuhan.
3855,In hīnang nila langgal saraꞌ sin agama.
3856,Sabab amura manga imam in makajari kumaun sin kakaun bakas iyungsud pa Tuhan.
3857,Iban walaꞌ niyu ka nabacha ha lawm Kitab Tawrat sin in manga imam.
3858,Maghinang da ha lawm sin Bāy sin Tuhan sakahabaꞌ adlaw paghali-hali iban pagpudji pa Tuhan.
3859,Minsan da langgal saraꞌ in maghinang ha adlaw yan?
3860,Sagawaꞌ walaꞌ sila nakarusa.
3861,"Na, ini in hibaytaꞌ ku kaniyu."
3862,Awn dī bihaun kaniyu in labi in kawasa dayn ha saraꞌ agama.
3863,Awn Parman sin Tuhan kiyasulat ha lawm Kitab.
3864,"Amu agi, ‘Bukun mahalgaꞌ kākuꞌ in manga hayup hiungsud niyu pagkulbanan."
3865,"Sagawaꞌ in kabayaan ku tuud, bayngꞌulungun kamu ha pagkahi niyu.’"
3866,"Na, bang niyu kiyahātihan tuud in maana sin himumūngan yan,” laung hi Īsa."
3867,“Walaꞌ niyu na biyutangan hukuman in tau amu in bunnal walaꞌ nakarusa.
3868,In Anak Mānusiyaꞌ amu in makapagbayaꞌ umiyan.
3869,Bang unu in mapatut hinangun ha adlaw paghali-hali iban pagpudji pa Tuhan.”
3870,Manjari limanjal na hi Īsa sin panaw niya.
3871,Miyadtu siya simūd pa lawm langgal.
3872,Duun ha lawm langgal awn hambuuk tau nakukumay in lima niya.
3873,Iban awn da isab duun manga tau amu in mabayaꞌ manglawag dusa kan Īsa.
3874,"Laung nila, “Makajari ka ha saraꞌ sin agama natuꞌ magpauliꞌ ha nasasakit ha adlaw paghali-hali iban pagpudji pa Tuhan atawa diꞌ?”"
3875,"In sambung hi Īsa, laung niya, “Bang sawpama awn hambuuk bili-bili niyu ampa mahulug pa lawm lungag ha waktu adlaw paghali-hali iban pagpudji pa Tuhan."
3876,Diꞌ niyu ka kawaun dayn ha lawm lungag in bili-bili?
3877,In tau labi mahargaꞌ dayn sin bili-bili!
3878,Hangkan wayruun ngīꞌ niya ha lawm saraꞌ agama bang kamu huminang sin marayaw ha pagkahi niyu ha adlaw paghalihali iban pagpudji pa Tuhan.”
3879,"Sakali namung hi Īsa ha tau nakukumay in lima niya, laung niya, “Hunata in buktun mu.”"
3880,"Na, hiyunat na sin tau pikuk in buktun niya."
3881,Saruun-duun miyuntul nagbalik in buktun niya biyaꞌ da isab sin hansipak buktun niya.
3882,"Na, gimuwaꞌ dayn ha lawm langgal in manga Parisi."
3883,Ampa sila nagꞌisun bang biyaꞌ diin in kapatay nila kan Īsa.
3884,"Sakali nakarungug mayan hi Īsa sin isun sin manga Parisi, minīg siya dayn ha lugal yaun."
3885,"Pagꞌīg niya, mataud tau in miyurul kaniya."
3886,Napauliꞌ niya in katān nasasakit.
3887,Sagawaꞌ ībut-ibutan niya tuud in manga tau napauliꞌ niya diꞌ pasuysuyun sin pasal niya pa manga tau.
3888,Ha supaya siya diꞌ mabantug pa manga tau.
3889,Na in manga hīnang niya yan nakarihil kamakbulan sin Parman sin Tuhan.
3890,"Kiyasulat hi Nabi Isayas ha lawm Kitab, amu agi:"
3891,“Yari in daraakun napīꞌ ku.
3892,Siya in kalasahan ku iban makasulut tuud siya sin atay ku.
3893,Paruunun ku kaniya in Rū ku.
3894,Bat niya mapamahalayak in pasal sin kabuntulan sin hukuman ku ha mānusiyaꞌ katān.
3895,Sumagawaꞌ diꞌ siya dumā maglugat atawa mamahit bang siya mamichara ha manga tau.
3896,Iban diꞌ siya magbichara matanug ha manga karān-dānan.
3897,Mahanunut siya ha manga tau mahukaꞌ in pangandul nila pa Tuhan.
3898,Iban tiyatabang niya in hisiyu-siyu mangandul kaniya.
3899,Iban diꞌ tuud siya dumuhung sampay diꞌ niya mapatanyag tuud in kasabunnalan.
3900,Iban mapapanaw in kabuntulan sin hukuman sin Tuhan.
3901,Siya da in hiyuhuwat-huwat kapangandulan sin mānusiyaꞌ katān.”
3902,Manjari pagꞌubus yadtu awn hambuuk tau siyusūd saytan diyā mawn kan Īsa.
3903,In tau ini nabuta iban naumaw sabab siyusūd siya saytan.
3904,Sagawaꞌ napaguwaꞌ hi Īsa in saytan dayn ha lawm baran sin tau ini.
3905,Hangkan makakitaꞌ iban makabichara na siya.
3906,"Na, nahaylan tuud in manga tau nangingitaꞌ-ngitaꞌ duun."
3907,"Laung nila, “Siya na bahaꞌ ini in Almasi, hambuuk panubuꞌ hi Daud?”"
3908,"Pagdungug sin manga Parisi sin bichara sin manga tau, simambung sila."
3909,"Laung nila, “Mapaguwaꞌ niya in manga saytan dayn ha manga tau siyusūd saytan."
3910,"Sabab dihilan siya barakat hi Bilsibul, amu in Nakuraꞌ sin manga Saytan."
3911,Huminang sin biyaꞌ ha yan.”
3912,Sagawaꞌ kiyaingatan hi Īsa bang unu in ha lawm pamikil nila.
3913,"Hangkan, piyamungan niya sila, laung niya, “Bang in manga tau ha hambuuk hulaꞌ nababahagiꞌ."
3914,Nagdurugaing-dugaing agaran iban magbunuꞌ-biyunui.
3915,"Na, in hulaꞌ yan diꞌ lumugay magkangīꞌ da."
3916,Damikkiyan bang in manga tau hangka-kawman atawa maglahasiyaꞌ magsaggaꞌ-siyaggai.
3917,Na diꞌ lumugay kumangīꞌ da sila.
3918,"Na, hangkan bang sawpama bat dayn ha Saytan Puntukan in barakat ku magpaguwaꞌ ha manga saytan."
3919,Na hāti niya magkuntara in Saytan Puntukan iban sin manga tindug niya lāgiꞌ diꞌ lumugay kumangīꞌ na sila!
3920,"Na, in agi niyu hi Bilsibul in nagdihil kākuꞌ barakat magpaguwaꞌ sin manga saytan."
3921,"Na, bang bunnal in agi niyu yan, na hisiyu bahaꞌ isab in nagdihil barakat ha manga tindug niyu magpaguwaꞌ saytan?"
3922,In manga tindug niyu amuna in mamaytaꞌ sin kasāan sin pamikil niyu!
3923,Tantu in barakat ku magpaguwaꞌ saytan bukun dayn ha Saytan Puntukan.
3924,Sabab in yan nahinang ku dayn ha kusug sin Rū sin Tuhan.
3925,"Na, amu yan in tandaꞌ magpakitaꞌ kaniyu sin in pamarinta sin Tuhan yari na dī bihaun kaniyu.”"
3926,"Laung niya, “Wayruun tau makasūd manglangpas pa lawm bāy sin hambuuk tau makusug."
3927,Bang siya diꞌ kahukutan naa muna.
3928,"Na, bang siya kahukutan na, makawaꞌ na in unu-unu katān ha lawm bāy niya."
3929,Hisiyu-siyu in bukun agad kākuꞌ.
3930,In siya yan kimukuntara kākuꞌ.
3931,Iban hisiyu-siyu in diꞌ tumabang kākuꞌ magtipun magpatibuuk ha manga tau.
3932,Bat sila masukuꞌ sin Tuhan.
3933,Biyaꞌ niya da piyulak-palik in manga tau.
3934,"Hangkan, baytaan ta kamu, in katān dusa iban pamung mangīꞌ pa Tuhan sin manga tau."
3935,Ampunun da sin Tuhan.
3936,Sagawaꞌ hisiyu-siyu in mamung sin mangīꞌ ha Rū sin Tuhan.
3937,Diꞌ siya ampunun sin Tuhan.
3938,"Lāgiꞌ, hisiyu-siyu in mamung mangīꞌ kākuꞌ, amu in Anak Mānusiyaꞌ."
3939,Ampunun da siya sin Tuhan.
3940,"Sagawaꞌ hisiyu-siyu in mamung sin mangīꞌ ha Rū sin Tuhan, diꞌ siya maampun kasaumulan."
3941,"Biyaꞌ sawpama sin hambuuk kahuy, bang in kahuy yan marayaw."
3942,Tantu in bunga niya marayaw da isab.
3943,"Damikkiyan, bang in kahuy bukun marayaw, in bunga niya bukun da isab marayaw."
3944,Karnaꞌ kaingatan taniyu dayn ha bunga niya bang in kahuy yan marayaw atawa bukun.
3945,In kamu yan panipu tuud!
3946,Asal wayruun sa yan marayaw hikabichara niyu.
3947,Sabab asal mangīꞌ in lawm pamikil niyu.
3948,Karnaꞌ unu-unu in ha lawm pamikil sin tau amura isab in hikabichara niya.
3949,"Sabab in tau marayaw, in hinang iban bichara niya marayaw da isab."
3950,Sabab marayaw in ha lawm pamikil niya.
3951,"Sagawaꞌ in tau mangīꞌ, in hinang iban bichara niya mangīꞌ da isab."
3952,Sabab mangīꞌ in ha lawm pamikil niya.
3953,"Na, ini in hibaytaꞌ ku kaniyu."
3954,Bang dumatung na in adlaw paghukum ha manga mānusiyaꞌ.
3955,In tau katān subay mamaytaꞌ pasal sin manga katān bichara wayruun kapūsan bakas kiyapamung nila.
3956,Sabab in hukuman hibutang sin Tuhan kanila kawaun dayn ha manga bichara kiyapamung nila.
3957,Ampunun na ka sila atawa siksaun.
3958,Pagꞌubus namung in manga guru sin saraꞌ agama iban sin manga Parisi.
3959,"Laung nila, “Tuwan, mabayaꞌ kami kumitaꞌ hambuuk muꞌjijat dayn kaymu."
3960,Amu in tandaꞌ sin barakat mu.”
3961,"Sagawaꞌ in sambung hi Īsa, laung niya, “In manga tau sin masa bihaun ini landuꞌ tuud mangīꞌ."
3962,Iban miyutas na dayn ha Tuhan!
3963,Mabayaꞌ kamu kumitaꞌ muꞌjijat tandaꞌ sin barakat ku.
3964,Sagawaꞌ diꞌ ta kamu pakitaun unu-unu muꞌjijat.
3965,Luwal da amu in muꞌjijat biyaꞌ sin barakat kimugdan kan Nabi Yunus sin masa nakauna yadtu.
3966,Karnaꞌ in hi Yunus natūn sin istaꞌ dakulaꞌ.
3967,"Iban tūy dūm, tūy adlaw siya ha lawm tiyan sin istaꞌ dakulaꞌ."
3968,"Damikkiyan, in Anak Mānusiyaꞌ, ha susūngun ha lawm tūy dūm-adlaw duun siya ha lawm kubul."
3969,"Na, bang dumatung na in adlaw paghukum sin Tuhan ha manga mānusiyaꞌ katān."
3970,In manga tau dayn ha hulaꞌ Niniba manaksil da kaniyu.
3971,"Sabab in sila, pagdungug nila sin nasīhat hi Yunus."
3972,Magtūy sila nagkahagad iban nagtawbat sin manga dusa nila.
3973,"Na, baytaan ta kamu, awn dī bihaun in labi pa mataas dayn kan Yunus!"
3974,Iban duun da isab ha adlaw paghukum ha manga mānusiyaꞌ.
3975,In hambuuk pangiyan dayn ha hulaꞌ Siba manaksil da isab kaniyu.
3976,Sabab in siya minsan malayuꞌ in hulaꞌ niya miyadtu siya dimungug sin manga hinduꞌ marayaw hi Sultan Sulayman.
3977,"Na, baytaan ta kamu, awn dī bihaun in labi pa marayaw manghinduꞌ dayn kan Sulayman!"
3978,"Na, bang in saytan makaguwaꞌ na dayn ha lawm baran sin tau."
3979,Manglunsulan na yan ha hulaꞌ paslangan mahunit paghulaan.
3980,Lumawag lugal paghali-halihan niya.
3981,Saꞌ diꞌ siya makabāk lugal.
3982,"Na, mamung na in saytan pa baran niya."
3983,"Laung niya, ‘Magbalik na aku pa lawm baran sin tau bakas kiyabutangan ku.’"
3984,"Pagsūd niya in panaw niya, nakadakita na siya sin tau paghulaan ha lugal nahauban sin kahusgutan."
3985,"Na, sukan ku sin tau, ‘Ami in ya taga sin baran."
3986,Ampa kami maghuyap sin manga paraysa.’
3987,"Laung hi Īsa sin panaw niya, “Wayruun in panaghuyap sin baran sin tau.”"
3988,"Na, ini in hibaytaꞌ ku kaniyu."
3989,In tau katān in kawasa dayn ha saraꞌ agama.
3990,In manga tau dayn sin masa bihaun in kawasa dayn.
3991,"In manga tau mangīꞌ sin masa bihaun, in kawasa dayn."
3992,"Na, baytaan ta kamu."
3993,"Bang diꞌ ka mapatud sin kawasa dayn, diꞌ kamu makain sin mga dusa kan Kawasa Dayn."
3994,"Na, ini in hibaytaꞌ ku kaniyu."
3995,Magwas it kinabuhi mu.
3996,Makipanggal kaluguran ta manga tau!
3997,Ampa magpakanaay!
3998,Sin adlaw da yadtu nanaug hi Īsa dayn ha bāy yadtu.
3999,Ampa siya miyadtu pa higad dagat.
4000,Duun siya limingkud nagnasīhat ha manga tau.
4001,Mataud tuud tau in miyawn nagtipun dumungug sin nasīhat niya.
4002,Hangkan simakat siya pa taas kumpit asibiꞌ.
4003,Ampa siya limingkud nagnasīhat.
4004,Ampa in manga tau duun ha higad daplakan dimurungug kaniya.
4005,"Na, mataud in niyasīhat niya ha manga tau."
4006,Iban diyalil niya kaagi in pagnasīhat niya.
4007,"Laung niya, “Awn yaun hambuuk tau miyadtu nagtanum binhiꞌ pa uma niya.”"
4008,In kaagi niya nagtanum.
4009,Siyabud niya in manga binhiꞌ.
4010,In kaibanan binhiꞌ nahulug pa labayan.
4011,Na pagkawn sin manga manuk-manuk nakaun in manga binhiꞌ.
4012,In kaibanan binhiꞌ nahulug pa lupaꞌ mabatu.
4013,Iban hangkatiyuꞌ da in lupaꞌ niya.
4014,"Na, hangkarayꞌ da timubuꞌ in manga binhiꞌ."
4015,Sabab mababaw da in lupaꞌ niya.
4016,Sumagawaꞌ kiyapasuan mayan suga.
4017,Nangluyluy in tiyanum sabab bukun malawm in gamut niya.
4018,In kaibanan binhiꞌ nahulug pa lupaꞌ tiyutubuan sin manga kasagbutan matunuk.
4019,"Pagtubuꞌ sin manga binhiꞌ, tiyaꞌlung sin manga sagbut matunuk."
4020,"Na, in kaibanan binhiꞌ nahulug pa lupaꞌ marayaw."
4021,Hangkan jimatu in tubuꞌ nila iban nagbunga marayaw.
4022,In bunga sin kaibanan landuꞌ tuud mataud.
4023,In kaibanan mataud.
4024,Ampa in kaibanan sarang-sarang in taud sin bunga niya.”
4025,"Na, mahuli dayn duun, laung hi Īsa, “In sasukuꞌ sin kamu nakarungug, dunguga niyu tuud in biyaytaꞌ ku yan kaniyu.”"
4026,Sakali miyawn kan Īsa in manga mulid niya ampa nangasubu kaniya.
4027,"Laung nila, “Maytaꞌ ha sakabaꞌ kaw magnasīhat dalilun mu pa manga isturi malawm in maana niya?”"
4028,"Simambung hi Īsa, laung niya, “In kamu yan kiyarihilan na ingat iban panghāti pasal sin kahālan sin pamarinta sin Tuhan."
4029,Amu in bakas līlibun dayn ha pikilan sin mānusiyaꞌ!
4030,Sagawaꞌ in manga tau yan walaꞌ kiyarihilan sin ingat iban panghāti pasal yan.
4031,Karnaꞌ hisiyu-siyu in magparachaya tuud ha hinduꞌ diyungug nila.
4032,Na sūngan sin Tuhan in panghāti nila.
4033,Iban maglabi-labihan in hirihil kanila.
4034,Sagawaꞌ hisiyu-siyu in wayruun parachaya nila.
4035,Minsan in maniyuꞌ-tiyuꞌ ingat iban panghāti nila kawaan da dayn kanila.
4036,Hangkan ku dalilun in pagnasīhat ku pa manga isturi malawm in maana niya sabab sin manga tau amu in way bayaꞌ nila magad sin hinduꞌ ku.
4037,Hangkan amu in pagꞌiyanun minsan sila imaatud diꞌ nila kakitaan.
4038,Iban minsan sila dimurungug diꞌ nila kahātihan.
4039,"Na, nabunnal tuud in kiyabaytaꞌ hi Nabi Isayas ha lawm Kitab, amu agi,"
4040,"‘In manga tau ini dimurungug, sagawaꞌ wayruun bayaꞌ nila humāti."
4041,"Imaatud sila, sagawaꞌ diꞌ nila kitaun tuud marayaw."
4042,Dayn ha sabab matugas in atay nila.
4043,Hiyuhulat nila in taynga nila.
4044,Iban pīpirung nila in mata nila.
4045,"Sabab bang bukun biyaꞌ ha yan in hinang nila,"
4046,"Tantu makakitaꞌ in mata nila, makarungug in taynga nila,"
4047,Makahāti in pamikil nila
4048,"Iban magbalik in atay nila kākuꞌ,’ laung sin Tuhan, ‘ampa ku ampunun in manga dusa nila.’ ”"
4049,"Na, laung hi Īsa ha manga mulid niya, “In manga kamu yan masukud tuud, sabab in manga kakitaan iban karungugan niyu kahātihan niyu!"
4050,"Na, baytaan ta kamu, mataud manga nabi iban manga tau sukuꞌ sin Tuhan sin masa nakauna yadtu in mabayaꞌ tuud kumitaꞌ sin manga kīkitaꞌ niyu bihaun."
4051,Sagawaꞌ walaꞌ nila kītaꞌ.
4052,"Iban mabayaꞌ tuud sila dumungug sin manga diyurungug niyu bihaun, sagawaꞌ walaꞌ nila diyungug.”"
4053,"Na, dungug kamu tuud ampa niyu kahātihan in maana sin dalilan pasal sin tau nagtanum."
4054,In manga tau nakarungug sin Baytaꞌ Marayaw pasal sin pamarinta sin Tuhan.
4055,Sagawaꞌ diꞌ nila kahātihan.
4056,Amuna in biyaꞌ sapantun sin manga binhiꞌ iban sin dān labayan kiyahulugan nila.
4057,"Na, pagkawn sin Saytan, amu in puunan sin katān kangīan."
4058,Maagaw dayn ha lawm atay nila in hinduꞌ sin Baytaꞌ Marayaw.
4059,In manga binhiꞌ iban sin lupaꞌ mabatu kiyahulugan nila amuna in biyaꞌ sapantun sin manga tau timaymaꞌ.
4060,Iban pagkūg-kuyag pagdungug nila na mayan sin Baytaꞌ Marayaw pasal sin pamarinta sin Tuhan.
4061,Sagawaꞌ diꞌ maggamut in hinduꞌ sin Baytaꞌ Marayaw ha lawm atay nila.
4062,Iban hangkarayꞌ da in tatasan nila.
4063,Hangkan bang sila datungan na kasusahan atawa kabinsanaan.
4064,"Sabab sin pagtaymaꞌ sin hinduꞌ sin Baytaꞌ Marayaw, magtūy nila butawanan na in pangandul nila ha Tuhan."
4065,"In manga binhiꞌ iban sin lupaꞌ kiyahulugan nila, amu in tiyutubuan sin sagbut matunuk."
4066,Amuna in biyaꞌ sapantun sin manga tau nakarungug sin Baytaꞌ Marayaw pasal sin pamarinta sin Tuhan.
4067,Sagawaꞌ masi sila magsusa sin manga palihālan dī ha dunya.
4068,Iban malabi ha atay nila in manga altaꞌ.
4069,Hangkan maluppas sadja in karayawan makapabuntul sin kawl-piil nila.
4070,Amu in makawaꞌ nila dayn ha hinduꞌ sin Baytaꞌ Marayaw.
4071,In sila yan biyaꞌ da sapantun tiyanum diꞌ magbunga.
4072,Ampa in manga binhiꞌ iban sin lupaꞌ marayaw kiyahulugan nila amuna in biyaꞌ sapantun sin manga tau nakarungug sin Baytaꞌ Marayaw pasal sin pamarinta sin Tuhan.
4073,Iban kiyahātihan nila sabab nagkahagad sila sin hinduꞌ.
4074,Hangkan sumūng in dayaw sin kawl-piil nila.
4075,In kaibanan landuꞌ tuud dumayaw.
4076,In kaibanan isab dumayaw tuud.
4077,Ampa in kaibanan sarang-sarang in dayaw nila.”
4078,"Manjari nagnasīhat na isab hi Īsa kanila, diyalil niya kaagi."
4079,"Laung niya, “In hantang sin pamarinta sin Tuhan hikadalil ta pa kahālan sin pagtanum iban pagꞌani sin tiyanum."
4080,Biyaꞌ ha ini in hantang niya.
4081,Awn hambuuk tau nagtanum binhiꞌ marayaw ha uma niya.
4082,"Sakali, hambuuk dūm ha saꞌbu natutūg na in tau katān."
4083,Miyawn in banta sin tau yaun pa uma ampa niya tiyanuman sagbut ha daig piyagtanuman sin binhiꞌ.
4084,Ubus ampa siya minīg.
4085,Sakali miyawn sab ka bayu ha tubig siyangan sin uma niya.
4086,Katungkalan niya ampa nan tula pa sin dalan ampa mapa.
4087,Maytin in tubig ha uma niya.
4088,Na pa nakarungug siya sin Baytaꞌ Marayaw.
4089,Hanggap na amu in pagtanum.
4090,In Baytaꞌ Marayaw amu in pamarinta sin Tuhan.
4091,In tao na magtanum binhiꞌ amu in mga tau nagapatal.
4092,Ampa in iba nagkukuitan amu in mga tau nagpakaraw.”
4093,Manjari miyawn kan Īsa in manga Parisi iban sin manga guru sin saraꞌ agama dayn ha Awrusalam Baytal Makdis.
4094,"Iyasubu nila hi Īsa, laung nila,"
4095,“Maytaꞌ in manga mulid mu diꞌ magkahagad sin manga biatan sin kamaasan natuꞌ?
4096,Kumaun sila minsan sila walaꞌ nakapagsuchi sin manga lima nila!”
4097,"In sambag hi Īsa, laung niya,"
4098,"“Na, maytaꞌ isab in kamu?"
4099,Atas niyu liyanggal in daakan sin Tuhan bang mayan niyu maagad in manga biatan sin manga kamaasan niyu amu in piyanghinduꞌ niyu!
4100,"Karnaꞌ nagparman in Tuhan, amu agi, ‘Pagꞌaddati niyu in inaꞌ-amaꞌ niyu.’"
4101,‘Hisiyu-siyu in manuknaꞌ ha amaꞌ atawa inaꞌ niya subay siya patayun.’
4102,Sagawaꞌ dugaing in hinduꞌ niyu ha manga tau.
4103,"Laung niyu, bang in hambuuk tau awn hipanabang niya ha maas niya, sagawaꞌ imiyan siya in tabang niya yan kiyaungsud niya pa Tuhan."
4104,"Na, makajari na minsan niya diꞌ na tabangun in maas niya."
4105,"Na, in hīnduꞌ niyu yan ha manga tau, karnaꞌ sin pagbawgbug niyu sin hinduꞌ biatan sin kamaasan niyu, amuna in nakapalayuꞌ ha manga tau dayn ha Parman sin Tuhan."
4106,In kamu yan nagpabawꞌ-bawꞌ sadja miyamagad sin daakan sin Tuhan.
4107,"Kiyugdan tuud kamu sin kiyabaytaꞌ hi Isayas ha lawm Kitab, amu agi sin Tuhan,"
4108,"‘Liyalagguꞌ aku sin manga tau sin lapal-kabtangan nila, sagawaꞌ malayuꞌ aku dayn ha atay nila.’"
4109,"Wayruun da pūs nila magpudji kākuꞌ sabab hibaytaꞌ nila sin in hīnduꞌ nila daakan dayn kākuꞌ, sagawaꞌ in kasabunnalan niya hinang-hinang nila sadja in hinduꞌ yan.”"
4110,"Pagꞌubus yadtu tiyawag hi Īsa in manga tau mataud pakawnun kaniya, ampa siya namichara, laung niya,"
4111,“Dungug kamu iban hātiha niyu in hibichara ku ini kaniyu.
4112,"In unu-unu makaun, makasūd pa lawm simud sin hambuuk tau, in yan diꞌ makasammal kaniya."
4113,Sagawaꞌ amu in makasammal kaniya in unu-unu mangīꞌ gumuwaꞌ dayn ha lawm simud niya.”
4114,"Sakali miyawn in manga mulid niya kaniya ampa namung, laung nila,"
4115,"“Tuwan, in manga Parisi kimangīꞌ in atay sin pamung mu.”"
4116,"Na, diyalil kaagi hi Īsa in sambung niya kanila, laung niya,"
